{
  "schema_version": "2.0.0",
  "snapshot_id": "dabc9655-87b9-402d-861d-128a5adf940f",
  "event": {
    "audio_path": "/Users/Omega/dev/capstone/localhost_demo/data/incoming/monotone.wav",
    "created_at": "2026-03-14T17:48:33.997983",
    "day": "2026-03-14",
    "source": "watchdog",
    "event_id": "f2c020e9-fd25-4b70-afd4-c0b8a54b1407",
    "received_at": "2026-03-14T21:48:34Z",
    "file_size_bytes": 1454350
  },
  "source_file": "monotone.wav",
  "processed_at": "2026-03-14T21:48:36Z",
  "transcript": {
    "speaker": "user",
    "timestamp": "2026-03-14T17:48:36.150501",
    "text": "Hello, hello, hello. This is me speaking and being very depressed.",
    "words": [
      {
        "word": "Hello,",
        "start": 0.0,
        "end": 0.66,
        "conf": 0.8043048977851868
      },
      {
        "word": "hello,",
        "start": 0.94,
        "end": 1.38,
        "conf": 0.8585092425346375
      },
      {
        "word": "hello.",
        "start": 1.6,
        "end": 2.08,
        "conf": 0.9463934302330017
      },
      {
        "word": "This",
        "start": 2.54,
        "end": 3.42,
        "conf": 0.9685071110725403
      },
      {
        "word": "is",
        "start": 3.42,
        "end": 3.94,
        "conf": 0.9979109168052673
      },
      {
        "word": "me",
        "start": 3.94,
        "end": 4.84,
        "conf": 0.9246487617492676
      },
      {
        "word": "speaking",
        "start": 4.84,
        "end": 5.28,
        "conf": 0.9945346117019653
      },
      {
        "word": "and",
        "start": 5.28,
        "end": 5.68,
        "conf": 0.985395610332489
      },
      {
        "word": "being",
        "start": 5.68,
        "end": 6.06,
        "conf": 0.9986732006072998
      },
      {
        "word": "very",
        "start": 6.06,
        "end": 6.36,
        "conf": 0.9971954822540283
      },
      {
        "word": "depressed.",
        "start": 6.36,
        "end": 6.72,
        "conf": 0.9966290593147278
      }
    ]
  },
  "metrics": {
    "word_count": 11,
    "duration_sec": 7.574,
    "speech_rate_wpm": 87.1,
    "articulation_rate_wpm": 99.783,
    "phonation_to_time_ratio": 0.7605,
    "pause_count": 3,
    "pause_rate_per_min": 23.764,
    "total_pause_time_sec": 0.96,
    "mean_pause_duration_sec": 0.32,
    "median_pause_duration_sec": 0.28,
    "long_pauses": 0,
    "medium_pauses": 0,
    "short_pauses": 3,
    "pauses": [
      {
        "after_word": "Hello,",
        "before_word": "hello,",
        "start": 0.66,
        "end": 0.94,
        "duration": 0.28,
        "pause_type": "short"
      },
      {
        "after_word": "hello,",
        "before_word": "hello.",
        "start": 1.38,
        "end": 1.6,
        "duration": 0.22,
        "pause_type": "short"
      },
      {
        "after_word": "hello.",
        "before_word": "This",
        "start": 2.08,
        "end": 2.54,
        "duration": 0.46,
        "pause_type": "short"
      }
    ],
    "type_token_ratio": 0.8181818181818182,
    "self_focus_ratio": 0.09090909090909091,
    "filler_word_count": 0,
    "sentiment_polarity": 0.0
  },
  "acoustic": {
    "f0_mean_hz": 93.53933003448851,
    "f0_std_hz": 6.62988063420681,
    "f0_range_hz": 32.1435,
    "jitter_local": 0.01836738241573617,
    "shimmer_local_db": 0.8454603846989264,
    "hnr_db": 14.267603555004907,
    "cpp": 0.4773995578289032,
    "spectral_cepstral": {
      "mfcc_1_mean": -392.9277648925781,
      "mfcc_2_mean": 105.70166015625,
      "mfcc_3_mean": 8.292691230773926,
      "mfcc_4_mean": 60.770301818847656,
      "spectral_flux_mean": 1.9278018474578857,
      "spectral_centroid_mean": 1446.412445441237,
      "spectral_slope_mean": 0.012846413999795914,
      "formant_f1_mean_hz": null,
      "formant_f2_mean_hz": null,
      "formant_f3_mean_hz": null,
      "vowel_space_area": null
    }
  },
  "validation": {
    "duration_sec": 7.574375,
    "sample_rate": 16000,
    "rms": 0.15695281326770782,
    "peak": 1.0,
    "warnings": [
      "Possible clipping detected (peak=1.0000)"
    ]
  },
  "calculators": {
    "linguistic": {
      "word_count": 11,
      "duration_sec": 7.574,
      "speech_rate_wpm": 87.1,
      "articulation_rate_wpm": 99.783,
      "phonation_to_time_ratio": 0.7605,
      "pause_count": 3,
      "pause_rate_per_min": 23.764,
      "total_pause_time_sec": 0.96,
      "mean_pause_duration_sec": 0.32,
      "median_pause_duration_sec": 0.28,
      "long_pauses": 0,
      "medium_pauses": 0,
      "short_pauses": 3,
      "pauses": [
        {
          "after_word": "Hello,",
          "before_word": "hello,",
          "start": 0.66,
          "end": 0.94,
          "duration": 0.28,
          "pause_type": "short"
        },
        {
          "after_word": "hello,",
          "before_word": "hello.",
          "start": 1.38,
          "end": 1.6,
          "duration": 0.22,
          "pause_type": "short"
        },
        {
          "after_word": "hello.",
          "before_word": "This",
          "start": 2.08,
          "end": 2.54,
          "duration": 0.46,
          "pause_type": "short"
        }
      ],
      "type_token_ratio": 0.8181818181818182,
      "self_focus_ratio": 0.09090909090909091,
      "filler_word_count": 0,
      "sentiment_polarity": 0.0
    },
    "acoustic": {
      "f0_mean_hz": 93.53933003448851,
      "f0_std_hz": 6.62988063420681,
      "f0_range_hz": 32.1435,
      "jitter_local": 0.01836738241573617,
      "shimmer_local_db": 0.8454603846989264,
      "hnr_db": 14.267603555004907,
      "cpp": 0.4773995578289032,
      "spectral_cepstral": {
        "mfcc_1_mean": -392.9277648925781,
        "mfcc_2_mean": 105.70166015625,
        "mfcc_3_mean": 8.292691230773926,
        "mfcc_4_mean": 60.770301818847656,
        "spectral_flux_mean": 1.9278018474578857,
        "spectral_centroid_mean": 1446.412445441237,
        "spectral_slope_mean": 0.012846413999795914,
        "formant_f1_mean_hz": null,
        "formant_f2_mean_hz": null,
        "formant_f3_mean_hz": null,
        "vowel_space_area": null
      }
    }
  }
}