{
  "schema_version": "1.0.0",
  "snapshot_id": "97711e08-fa0b-4c17-8f06-443f39daade1",
  "event": {
    "audio_path": "/Users/Omega/dev/capstone/localhost_demo/data/incoming/happy.wav",
    "created_at": "2026-03-14T16:19:25.466038",
    "day": "2026-03-14",
    "source": "watchdog",
    "event_id": "1a29b610-4935-4397-86e3-e88a4b67a1af",
    "received_at": "2026-03-14T20:19:50Z",
    "file_size_bytes": 1433042
  },
  "source_file": "happy.wav",
  "processed_at": "2026-03-14T20:20:00Z",
  "transcript": {
    "text": "Hello, hello. Oh my god, I'm so happy today. I'm so happy",
    "words": [
      {
        "word": "Hello,",
        "start": 0.0,
        "end": 0.78,
        "conf": 0.8542371392250061
      },
      {
        "word": "hello.",
        "start": 1.06,
        "end": 1.82,
        "conf": 0.8879952430725098
      },
      {
        "word": "Oh",
        "start": 2.6,
        "end": 3.3,
        "conf": 0.9617828130722046
      },
      {
        "word": "my",
        "start": 3.3,
        "end": 3.42,
        "conf": 0.8894169330596924
      },
      {
        "word": "god,",
        "start": 3.42,
        "end": 3.62,
        "conf": 0.7361922264099121
      },
      {
        "word": "I'm",
        "start": 3.72,
        "end": 4.04,
        "conf": 0.9774326384067535
      },
      {
        "word": "so",
        "start": 4.04,
        "end": 4.28,
        "conf": 0.9985296726226807
      },
      {
        "word": "happy",
        "start": 4.28,
        "end": 4.8,
        "conf": 0.9984294772148132
      },
      {
        "word": "today.",
        "start": 4.8,
        "end": 5.18,
        "conf": 0.9909231066703796
      },
      {
        "word": "I'm",
        "start": 5.6,
        "end": 6.0,
        "conf": 0.9440315365791321
      },
      {
        "word": "so",
        "start": 6.0,
        "end": 6.26,
        "conf": 0.9979568719863892
      },
      {
        "word": "happy",
        "start": 6.26,
        "end": 6.78,
        "conf": 0.9988204836845398
      }
    ]
  },
  "metrics": {
    "word_count": 12,
    "type_token_ratio": 0.6667,
    "duration_sec": 6.78,
    "speech_rate_wpm": 106.2,
    "pause_count": 4,
    "total_pause_time_sec": 1.58,
    "mean_pause_duration_sec": 0.395,
    "long_pauses": 0,
    "medium_pauses": 1,
    "short_pauses": 3,
    "pauses": [
      {
        "after_word": "Hello,",
        "before_word": "hello.",
        "start": 0.78,
        "end": 1.06,
        "duration": 0.28,
        "pause_type": "short"
      },
      {
        "after_word": "hello.",
        "before_word": "Oh",
        "start": 1.82,
        "end": 2.6,
        "duration": 0.78,
        "pause_type": "medium"
      },
      {
        "after_word": "god,",
        "before_word": "I'm",
        "start": 3.62,
        "end": 3.72,
        "duration": 0.1,
        "pause_type": "short"
      },
      {
        "after_word": "today.",
        "before_word": "I'm",
        "start": 5.18,
        "end": 5.6,
        "duration": 0.42,
        "pause_type": "short"
      }
    ]
  },
  "acoustic": {
    "f0_mean_hz": 124.31344348390385,
    "hnr_db": 10.810351985240894,
    "jitter_local": 0.02974585873577733,
    "shimmer_local_db": 0.9146935950904478,
    "opensmile": {
      "F0semitoneFrom27.5Hz_sma3nz_amean": 25.624771118164062,
      "F0semitoneFrom27.5Hz_sma3nz_stddevNorm": 0.13897201418876648,
      "F0semitoneFrom27.5Hz_sma3nz_percentile20.0": 22.94864845275879,
      "F0semitoneFrom27.5Hz_sma3nz_percentile50.0": 25.949533462524414,
      "F0semitoneFrom27.5Hz_sma3nz_percentile80.0": 28.18220329284668,
      "F0semitoneFrom27.5Hz_sma3nz_pctlrange0-2": 5.233554840087891,
      "F0semitoneFrom27.5Hz_sma3nz_meanRisingSlope": 190.30262756347656,
      "F0semitoneFrom27.5Hz_sma3nz_stddevRisingSlope": 364.33258056640625,
      "F0semitoneFrom27.5Hz_sma3nz_meanFallingSlope": 49.43971252441406,
      "F0semitoneFrom27.5Hz_sma3nz_stddevFallingSlope": 37.68764114379883,
      "loudness_sma3_amean": 0.717042088508606,
      "loudness_sma3_stddevNorm": 0.7680318355560303,
      "loudness_sma3_percentile20.0": 0.2045181393623352,
      "loudness_sma3_percentile50.0": 0.5537689328193665,
      "loudness_sma3_percentile80.0": 1.2175872325897217,
      "loudness_sma3_pctlrange0-2": 1.0130691528320312,
      "loudness_sma3_meanRisingSlope": 10.882486343383789,
      "loudness_sma3_stddevRisingSlope": 5.730595111846924,
      "loudness_sma3_meanFallingSlope": 7.560798168182373,
      "loudness_sma3_stddevFallingSlope": 4.103094577789307,
      "spectralFlux_sma3_amean": 0.382344514131546,
      "spectralFlux_sma3_stddevNorm": 1.110215663909912,
      "mfcc1_sma3_amean": 27.4315128326416,
      "mfcc1_sma3_stddevNorm": 0.5072125196456909,
      "mfcc2_sma3_amean": 1.8144928216934204,
      "mfcc2_sma3_stddevNorm": 6.537603855133057,
      "mfcc3_sma3_amean": 25.27937126159668,
      "mfcc3_sma3_stddevNorm": 0.569018542766571,
      "mfcc4_sma3_amean": -3.1451833248138428,
      "mfcc4_sma3_stddevNorm": -4.527644157409668,
      "jitterLocal_sma3nz_amean": 0.018917180597782135,
      "jitterLocal_sma3nz_stddevNorm": 1.1448824405670166,
      "shimmerLocaldB_sma3nz_amean": 0.8281805515289307,
      "shimmerLocaldB_sma3nz_stddevNorm": 0.9395122528076172,
      "HNRdBACF_sma3nz_amean": 5.942024230957031,
      "HNRdBACF_sma3nz_stddevNorm": 0.38666677474975586,
      "logRelF0-H1-H2_sma3nz_amean": 6.511658191680908,
      "logRelF0-H1-H2_sma3nz_stddevNorm": 0.7619463205337524,
      "logRelF0-H1-A3_sma3nz_amean": 24.67290687561035,
      "logRelF0-H1-A3_sma3nz_stddevNorm": 0.2761559784412384,
      "F1frequency_sma3nz_amean": 625.3822021484375,
      "F1frequency_sma3nz_stddevNorm": 0.32417020201683044,
      "F1bandwidth_sma3nz_amean": 1344.9814453125,
      "F1bandwidth_sma3nz_stddevNorm": 0.1399879902601242,
      "F1amplitudeLogRelF0_sma3nz_amean": -139.46316528320312,
      "F1amplitudeLogRelF0_sma3nz_stddevNorm": -0.6114792227745056,
      "F2frequency_sma3nz_amean": 1669.3485107421875,
      "F2frequency_sma3nz_stddevNorm": 0.17726847529411316,
      "F2bandwidth_sma3nz_amean": 1004.8706665039062,
      "F2bandwidth_sma3nz_stddevNorm": 0.3071683645248413,
      "F2amplitudeLogRelF0_sma3nz_amean": -141.91473388671875,
      "F2amplitudeLogRelF0_sma3nz_stddevNorm": -0.5663464069366455,
      "F3frequency_sma3nz_amean": 2701.65478515625,
      "F3frequency_sma3nz_stddevNorm": 0.10099045932292938,
      "F3bandwidth_sma3nz_amean": 770.3826293945312,
      "F3bandwidth_sma3nz_stddevNorm": 0.37715813517570496,
      "F3amplitudeLogRelF0_sma3nz_amean": -142.71607971191406,
      "F3amplitudeLogRelF0_sma3nz_stddevNorm": -0.5548629760742188,
      "alphaRatioV_sma3nz_amean": -15.696098327636719,
      "alphaRatioV_sma3nz_stddevNorm": -0.39798617362976074,
      "hammarbergIndexV_sma3nz_amean": 22.031482696533203,
      "hammarbergIndexV_sma3nz_stddevNorm": 0.30729782581329346,
      "slopeV0-500_sma3nz_amean": 0.013776708394289017,
      "slopeV0-500_sma3nz_stddevNorm": 1.541532039642334,
      "slopeV500-1500_sma3nz_amean": -0.024748310446739197,
      "slopeV500-1500_sma3nz_stddevNorm": -0.6196064352989197,
      "spectralFluxV_sma3nz_amean": 0.5243282318115234,
      "spectralFluxV_sma3nz_stddevNorm": 0.5786182284355164,
      "mfcc1V_sma3nz_amean": 36.599082946777344,
      "mfcc1V_sma3nz_stddevNorm": 0.20248879492282867,
      "mfcc2V_sma3nz_amean": 2.5063750743865967,
      "mfcc2V_sma3nz_stddevNorm": 5.029452800750732,
      "mfcc3V_sma3nz_amean": 30.204402923583984,
      "mfcc3V_sma3nz_stddevNorm": 0.4654031991958618,
      "mfcc4V_sma3nz_amean": -12.127303123474121,
      "mfcc4V_sma3nz_stddevNorm": -1.1442121267318726,
      "alphaRatioUV_sma3nz_amean": -9.659775733947754,
      "hammarbergIndexUV_sma3nz_amean": 16.53291893005371,
      "slopeUV0-500_sma3nz_amean": -0.0028914883732795715,
      "slopeUV500-1500_sma3nz_amean": -0.0033781114034354687,
      "spectralFluxUV_sma3nz_amean": 0.3162955343723297,
      "loudnessPeaksPerSec": 3.2214765548706055,
      "VoicedSegmentsPerSec": 1.8918919563293457,
      "MeanVoicedSegmentLengthSec": 0.1664285659790039,
      "StddevVoicedSegmentLengthSec": 0.12215956300497055,
      "MeanUnvoicedSegmentLength": 0.3186666667461395,
      "StddevUnvoicedSegmentLength": 0.26879647374153137,
      "equivalentSoundLevel_dBp": -19.401042938232422
    }
  },
  "validation": {
    "duration_sec": 7.463375,
    "sample_rate": 16000,
    "rms": 0.10705135762691498,
    "peak": 1.0,
    "warnings": [
      "Possible clipping detected (peak=1.0000)"
    ]
  }
}